{
  "id": "ent-fu-shan-hai-e45587d9d7",
  "module": "entity",
  "lemma": "李沉舟",
  "zh": "李沉舟",
  "type": "person",
  "aliases": [],
  "drama": "fu-shan-hai",
  "examples": [
    {
      "en": "Of the three—Li Chenzhou, Zhao Shirong, and Liu Suifeng—very few have ever seen their true faces.",
      "zh": "李沉舟、赵师容、柳随风这三人，知道他们真容的，也并没有几个。",
      "source": "drama:fu-shan-hai:8:s4-q2"
    }
  ],
  "tags": [
    "成毅",
    "权力帮帮主，外号「君临天下」，与萧秋水亦敌亦友，大熙皇族、当今皇帝亲弟"
  ],
  "freq": 1
}
